{
  "coverage_level": "inventory_only",
  "document_id": "document_ole_example001",
  "header": {
    "content_hash": "cd0dc219f7381177a8afb3be7159073b06663279a49167020bf48c1b3f4b226e",
    "contract_id": "profile_legacy_ole_kea4zbx4rgztolakyhfyacxw6z",
    "created_at": "2026-06-20T07:10:14.040910Z",
    "extensions": {},
    "producer": "vysi.document_source",
    "producer_version": "0.4.0",
    "revision": 1,
    "schema_id": "document_source.profile_legacy_ole",
    "schema_version": "2.2.0",
    "status": "ok",
    "supersedes": null
  },
  "profile_kind": "legacy_ole",
  "profile_version": "2.0.0",
  "semantic_format_hint": "doc",
  "storages": [
    {
      "parent_id": null,
      "path": "Root Entry",
      "storage_id": "storage_example001"
    }
  ],
  "streams": []
}
